,article_id,comments,is_reply,neg,neu,pos,compound
222,3.0,"streaming or not, its the MOE educating system that has become hardcore in the way teachers behave! in neighborhood schools, principals and teachers no longer inspired to groom students anymore! they are not educators at all these days! they resort to become MOE messengers, just to complete their assignments and pass on their jobs in the most easiest ways!
they are monitored and tracked for their schools status quo and that's all.

whereas SEP schools teachers are given targets, and being challenged not falling under the academic standards from previous. hence, they focus on teaching and academic excellence....

can MOE switch these teachers around to ensure holistic and academic teachings are not just genuinely available in SEP schools.... if this exists, then streaming or non-streaming will have the correct outcomes from all schools!
More",0.0,0.025,0.894,0.08,0.8362
223,3.0,https://www.youtube.com/watch?v=SRRSBZOyFIc,0.0,0.0,1.0,0.0,0.0
224,3.0,"and for the so call poor, if his gst per month is above a certain amount, his gst rate will increase. but like that more tracking of identities and compromise privacy.",1.0,0.063,0.751,0.186,0.5041
225,3.0,the video show a title text the rich (more more) instead of burdening the poor with gst. but the thing is a lot of the legal poor already not paying income tax already. my suggestion is to enract laws to make it complusory for the rich to splurge their wealth on consumer goods and services and make more gungho investments and also to donate to charity.,1.0,0.098,0.693,0.21,0.8765
226,3.0,President's son can get 12-year deferment from NS while commoners thwanked for 3-4 years will kenna jail. Sure our social stratification is just because of the education system???,0.0,0.0,0.905,0.095,0.4291
227,3.0,"I supposed just as EXPECTED.

Years ago, I was questioned by one of Yahoo's Blogger here in a casual post.

Regarding P@P's U-Turn Policies, during the discussions.

I had given that blogger(a lady, moniker with hold) just 2 instances as examples.

1) U-Turn on the Presidency Selection and
2) U-Turn on the Education System.
3) U-Turn on the CPF Issue(latest addition.)

And I mean U-Turn in the true sense as with a Car U-Turn.

U-Turn once, it will be in the opposite side of the road.

U-Turn again, it will be at the Starting Place.

P@P Policies have been U-Turning again and again....

So do we have Good Presidents or Nobel Prize Scholars?(other than $,$$$,$$$ Elites..)

How will Singapore end up if we have U-Turns upon U-Turns......?
More",0.0,0.011,0.902,0.087,0.8677
228,3.0,地理人和时鸡。,1.0,0.0,1.0,0.0,0.0
229,3.0,"Louis Ng, please QUESTION Yaccob, will it take FOREVER for him to decide whether HIS SONS will serve NS?!!!",0.0,0.0,0.85,0.15,0.4898
230,3.0,"Just fxxking he'll let the students do physics, chemistry, maths and science apart from English and other subjects . Now all mps coming out to support local citizens and giving them job offers. This could have been done immediately in their last election , but unfortunately no, it's the next 5vtears when election looms.",0.0,0.134,0.805,0.061,-0.6428
231,3.0,"1) Locals charged with molesting crimes - always kenna jail and CANNING
2) Foreigners charged with molesting crimes - given probation and NO canning.

.... and this Louis Ng so smart to find social stratification is due to our education system streaming process, hor.
More",0.0,0.259,0.677,0.064,-0.8639
232,3.0,"good to hear from MP Louis Ng again, he used to be very vocal about animal rights but became silent after he entered parliament. he is the
right person to talk about the terrible scourge happening in this country,
the massive destruction of primary forests. it's alarming especially in the west part where i live, pls stop destroying the limited green just for the money. incidentally we have a new kid on the block to speak for us, he is NMP Associate Prof Walter Theseira, pls give a listen to him.",0.0,0.231,0.724,0.045,-0.9719
233,3.0,Maybe he was told to keep quite just to take 16K and actsee actsee can already. Nowadays all teh G are doing it when looking their bank account millions $$$ into it!,1.0,0.0,1.0,0.0,0.0
234,3.0,This country need a reboot. Policies that were implemented the last 30 years should completely wipe out because that is about the point in time when our leaders start cultivate the elitism thinking and band themselves and a selected group as talent and the rest as commoner that are expendable.,0.0,0.0,0.944,0.056,0.4215
235,3.0,"Why don't have all these streams as options and let the student find which is better for themselves and make their own progress. They can discuss with parent, school counsellors to see what fit them. When MOE stream students, it making a judgement about them and it cause a feeling of low esteem.",0.0,0.036,0.796,0.168,0.765
236,3.0,I know many people who are good in science but not math .. after a while they become gd at maths after they realised it is fixed .. but it is too late .. or good in language but not math or good in math but not in language.. so they end up losing out as not gd in all subjects. Subject based banding is better,0.0,0.045,0.777,0.178,0.8779
237,3.0,"Streaming is GOOD. No good student should be forced to mix with those trouble-making, parang-wielding and noise-generating students; you just can't focus and concentrate in class, and all the more unable to learn Anything from them! Yes, I DO mean a particular group/ race when I am describing those useless kids, where most of them come from dysfunctional families with the dad's IN PRISON and the mom not EDUCATED enough to discipline the kids.",0.0,0.144,0.748,0.108,-0.4753
238,3.0,"@SG Pai Kia LOL Who call themselves 'pai kia' on the net??? Oh yeah...useless keyboard monkey who wants to 'scare' others by naming herself 'pai kia'.

Btw what colour is your panties?",1.0,0.223,0.692,0.084,-0.78
239,3.0,"I just screwed you mum last night, she told me your dad is in prison.",1.0,0.351,0.649,0.0,-0.7579
240,3.0,Racist comment...,1.0,0.8,0.2,0.0,-0.6124
241,3.0,"The dad would be more of a wasted smoker, drinker, womanizer, druggie, lowly educated and uncultured, crime-practitioner.

The mom, a pig or a stick, on the hole a whole...

Good pairing, with a brood of monkey-junkies...
More",1.0,0.147,0.776,0.078,-0.3774
242,3.0,Streaming is detrimental to students in the normal stream. It should be abolished. Other countries do not have it. MOE should study the models in other countries and adopt a model that is suitable for us here.,0.0,0.0,0.954,0.046,0.1779
243,3.0,"Now Did our PAP go deeper and investigate who employ him and any under table bribery take place.
PAP cannot take it lightly where whole island wide FT may have holding FAKE cert in our Singapore.
Does PAP still want to play waiting game for them committed crime where following up investigate take place ?
More",0.0,0.116,0.792,0.092,-0.5473
244,3.0,"unconventional policies like education streaming is so lame.
When you introduce the policy, you support it with lots of plausible arguments.

Mind you it affects generation of students,
their future has been affected by your policy, their opportunity has been stifled by your policy.

Now you want to overturn it, again, you support it with another set of plausible arguments.

Short-sighted and with no authority in running an education ministry.
More",0.0,0.196,0.654,0.15,-0.6269
245,3.0,"MP Louis Ng is one of the courageous few who dares to say the right thing. The harms have been done for many years. The pain and suffering the system has inflicted on many. Mental struggles of those who didn't benefit from the system and are still stigmatised for being laggards. Many youths had taken the SIW path and I hope they are in a better place. For those who think the system works, you just have to look at our Happiness Index. Are we a socially cohesive and vibrant society? WE ARE NOT.",0.0,0.13,0.725,0.145,0.3859
246,3.0,"Steaming is necessary to put different students into various groups, so that they can excel, those who does not really want to study or not so fast, should have a different class. Otherwise, if all are the same, we will end up a communist country.
Most children at young age and by statistics, already can be gauge on their intelligence and abilities. There is a small % of exceptions, but we cannot because of the small exception and affect the majority. Instead, we should look at the exception cases and apply a different help.",0.0,0.013,0.891,0.096,0.7833
247,3.0,"Louis Ng, I think you speak better for Animals Rights.
As to streaming, personally, I think you are NOT QUALIFY to COMMENT!!",0.0,0.0,0.845,0.155,0.5399
248,3.0,He didn't even open his mouth when the dogs went disappeared in the boarding home. Lol. Irony,1.0,0.156,0.704,0.141,0.1779
249,3.0,"To Everyone in this Website, Especially PAP, Opposition Parties & All Singaporean,

To improve our competitiveness in Global Economy , We really must REVAMP our entire school education system , in actual fact, it should have been Done it in over 20 years ago, during the 1990s .

From this website on “ Remove streaming in secondary schools to reduce social stratification ”, it has EXPOSE OUT these BIG PROBLEMS in Singapore that had spread over many years .

Unfortunately, our “ MOST EXPENSIVE GOVERNMENT IN THE WHOLE WORLD “ don’t seem to do much on it , though TALK very BIG in Mass Media that our “ MOST EXPENSIVE GOVERNMENT IN THE WHOLE WORLD “ is doing so ! ! !

The PROBLEMS that we are facing now are these , due to the very Harmful Effects of "" DON' T CARE "" of or , should say, SACRIFICE Professional Ethics & Moral Education for many years :===>

(1). Bad CORORATE CULTURES & Unethical SOCIAL VALUES are widespread in Singapore Business World & Singapore Society .

Even our so called "" MOST CLEAN & UNCORRUPTED CIVIL SERVICE IN THE WHOLE WORLD "" , which is Singapore Civil Service , are now affected, due to Big Scandals had happened over these few years, like of SEX – FOR - CONTRACT , SEX – FOR - GRADE , SEX - FOR - FAVOURS, UNDER - TABLE FAVORTISM , CORRUPTION , ABUSE of POWER , INTENTIONAL IRRESPONSIBLE ACTS & etc. .

(2). LACK of INTEREST on the Singaporean on things that affect National Interests & the Well-being of Society , which have led to the terrible consequences of Neglect .

[ WORST , it had led to INFLUENCIAL People , like so called “ ELITE CLASS “ as mention in here , that are Unethical HYPOCRITES & Big CHEATERS ( Like T T Durai , Richard Yong , Peter Lim Sin Pang , Ex-NUS Law Professor, Dr Tey , Pastor Kong Hee , Sun Ho ( Pastor Kong Kee’s wife ) & etc. ) to INFLUENCE the society or, BRAINWASH people to become BAD & EVIL .

Also , WORST , even civil servants, or staff under their control / charge are being made to be their almost YES MEN & LACKEYS / WALKING DOGS to do bad things or unethical acts for them , by forcing their staff to obey their ILLEGAL / UNLAWFUL / UNETHICAL ORDERS . . .

So, the Consequence is that you Either join them to be BAD GUYS too , or, You get SACK from your Jobs ! ! ! ]

(3). The KNOWLEDGE & SKILLS of Singaporean work forces are now facing STRONG COMPETITION from other newly emerged economic countries, like China & India .

The Ministry of Education has not change its educational systems much to counter this measures , may be due to Clumsiness , Complacency , Ignorance or WORST , PREVENT from doing so by some Self-Interest Pressure Groups within or outside of Civil Services , through erection of "" PROTECTIONISM "" inside the organizations .

* * * NOTE :==> As Mao Tze Tong, that Ex- Supreme Leader of China once said this words :==> “ If want to undergo Reform or Restructure, MUST first KNOW who your ENEMIES & FRIENDS are “ .

This is BECAUSE Friends will SUPPORT the Reform & Restructure, BUT, Enemies will OPPOSE the Reform & Restructure, regardless of how Good the Reform & Restructure are .

As this Old Chinese saying has highlighted : “ 非我族类，其心必异 “ or, “ 志不同 ， 道不合, 其心必异 “ or, “ 阳奉阴违 “ .
[ It means that anyone that don’t belong to our types or, share common belief & objectives with us, will likely go against us or, oppose us in his / her heart & DISOBEY Instruction from superiors ]

* * * NOTE :==> In last Bukit Batok By-Election, DPM Tharman said in public that VOTE Dr Chee Soon Juan to be MP of Bukit Batok is like “ GET A FOX TO GUARD HEN DEN “.

However, our Singapore Government has also “ GET A FOX TO GUARD HEN DEN “ too ! ! !

That is, our Singapore Government is really RIDICULOUS to ask such types of ANTI-REFORM Civil Servants & ANTI-RESTRUCTURE Employers to HELP in the REFORM & RESTRUCTURE Singapore Education system , so as to build up Singapore Economy to be 1st Class Economy & save the Job Security of Singaporean . . . So we can all GUESS out what are the Results ? ? ? ]

(4) Too Many so called “ FOREIGN TALENTS “ come into Singapore & some of them have brought lots of Bad CULTURES & Twisted IDEAS to badly INFLUENCE & BRAINWASH Singaporean population .

[ To Foreigners , certain BAD PRACTICES, like LOOSE SEX CULTURE , SEX - FOR - FAVOR , GAY PRACTCES , CHEATING , CORRUPTION , ” Game of Throne ” ( Chinese is called “ 权术游戏 “) types of BRUTALLY DIRTY OFFICE POLITICS, VIOLENT POLITICAL IDEAS & etc., are OK to them in their own nations & they SPREAD such Cultures & Ideas when they are in Singapore ]

Really need more “ FIREMAN “ type of Ministers, like Dr Khaw Boon Wah & even Mr Shanmugan, to CLEAN UP , make full HOUSE CLEANING ( Chinese mean : 清理门户 ) & RESTRUCTURE all the MESS that have happened in our ““ MOST EXPENSIVE CIVIL SERVICE IN THE WHOLE WORLD “ & even Private Sector . . .

Any COMMENTS from you PEOPLE out there ? ? ?
More",0.0,0.138,0.755,0.107,-0.9861
250,3.0,"GE lai liao! GE lai liao! Wah, now can see parliament now very very active, ALL the sudden, All these out of no where ministers suddenly show concern for the citizens, once in 5 years, wah... GE lai liao, GE lai liao, all the minister must open their golden mouth liao.... Lol",0.0,0.039,0.844,0.117,0.6657
251,3.0,Time for a change? It took how many decades for MOE to realize there’s a need for a change,0.0,0.0,1.0,0.0,0.0
252,3.0,“streaming is a sacred cow”... sounds like a caste system.. let’s abolish this elitist third world syndrome..,0.0,0.0,0.848,0.152,0.3612
253,3.0,"FT workers do not take away jobs from locals.
In fact, FT workers create morererer new jobs from money.",0.0,0.0,0.896,0.104,0.2732
254,3.0,This elitism mode was done by pap and this totally discriminates slowed developer which may also become top guys in the end. Short sightedness by pap,0.0,0.0,0.933,0.067,0.2023
255,3.0,Reduce streaming why dun reduce ur pay.,0.0,0.189,0.811,0.0,-0.1027
256,3.0,"The old Chinese saying goes, there’s no good or bad student. Only teacher who can teach or can’t",0.0,0.242,0.636,0.123,-0.4215
257,3.0,"At least a bright idea from a MIW, rather than status-quo all-is-all-right-business-as-usual attitude of Education Minister and MOE officials ! Really need to look at this especially when so many students drop out to do GrabFood and FoodPanda. MOE got numbers of dropout or not ? Of course got lah, but kbkb then sweep the numbers under the carpet and pretend all ok without any systemic changes or thinking of new ideas like this lor: is the streaming also creating classes of people forcing dropouts and not developing full potential of general population ? Wake up lah ! Look at Gifted Programme too which can only inspire elitism. Is Gifted Eductaion necessary especially there is no follow through in Sec School ? The programme is not 'Gifted' too. It is run of the mill Sec 3 do at P5, and renamed as 'Gifted'. Please lah, stop wasting resources like this to aid the general population.
More",0.0,0.075,0.791,0.135,0.9071
258,3.0,"1984 Orwellian Farm-ill-lee -
""All animals are equal, but some animals are more equal than others""!!!

A conscience-struck newbie-PAPig aka ""animal rights champion"" finally says the TRUTH!!!... despite usual DENIAL from Mafia Of E-ddict-cation!!!

TRUTH IS TRUTH!

Lying to court is criminal!

Lying to public is immoral and ubethical!!!
More",0.0,0.258,0.558,0.183,-0.7593
259,3.0,Educational Stress created by who??? Who started it ? and now wants to end it? Sigh,0.0,0.148,0.636,0.215,-0.3939
260,3.0,Good. another own self check own self. LoL,0.0,0.0,0.513,0.487,0.6908
261,3.0,"Louis is 100% correct! I support his thinking and idea. Ong ye kuang is stubbornly wrong having benefited from elite, what the hell does he knows. You never in that category how do you know? Louis should challenge ong, lets have a public debate which parents wants to categorized their children. If you dont want why the govt is doing that? Our education system is sucks!",0.0,0.195,0.752,0.053,-0.8949
262,3.0,"Election tactics lah, now act like good guy so people would say ""Garment care for them"" see what happen if they win the next election.",1.0,0.0,0.629,0.371,0.9081
263,3.0,One of the many useless jiao liao be in the house,0.0,0.219,0.781,0.0,-0.4215
264,3.0,Louis Ng is obviously an IDIOT.,0.0,0.446,0.554,0.0,-0.6166
