,article_id,comments,is_reply,neg,neu,pos,compound
63,1.0,"To Everyone in this Website, Especially PAP, Opposition Parties & All Singaporean,

What is the use if Singaporean have the BEST EDUCATION when this Cruel Reality in Singapore Labour Market is still IGNORE by Singapore Government :==>

From this website on Subject-Based Banding to replace streaming in secondary schools by 2024 by our Government, Ministry of Education & Singapore Government DON’T seem to care of these BIG PROBLEMS that are widespread in Singapore for many years , or can even say PURPOSELY IGNORE such BIG PROBLEM . . .

Not only blue collar jobs , even white collar jobs of highly educated younger Singaporean & university graduates are in danger too, due to Greedy Singapore employers hire Singaporean temporarily , like 1 - 6 months , & then SACK them with All types of EXCUSES , including Unscrupulously fabricated “ WITCH HUNTING “ Excuses . . .

After these“ ROUGE EMPLOYERS “ have any how SACK many Singaporean Employees from their Jobs , these “ ROUGE EMPLOYERS “ COMPLAIN to Relevant Authorities, like Ministry of Manpower, that Singaporean employees , for both with University Degree & Relevant qualification , are Bad , Lousy & etc. & then , use these “ EXCUSES “ to PRESS Singapore Government to allow more so called "" FOREIGN TALENTS "" or , any one with little educational qualification to be HIRE for PMET Jobs by them , BUT , paid such people with LOW SALARIES :===>

Eg : Engineer with recognized Degree from NUS, NTU or other recognized universities by MOE & several years of relevant working experience usually command salary of $3000 - $6000 /month , BUT , FOREIGN "" engineer "" that has NO recognized degrees or required certificates & with several years of "" Relevant Working Experience "" in other countries , can be paid salary at around $1000/month .

Eg : Architect that had recognized Degree from NUS, NTU or other recognized universities by MOE & several years of relevant working experience usually command salary of $6000 - $12000 /month , BUT , FOREIGN "" architect "" that has NO recognized degrees or required certificates & with several years of "" Relevant Working Experience "" in other countries , can be paid salary at around $1000 - $2000/month .

Eg : Accountant that had recognized Degree from NUS, NTU or other recognized universities by MOE usually command salary of $3000 - $9000 /month , BUT , FOREIGN "" accountant "" that has NO recognized degrees or required certificates & with several years "" Relevant Working Experience "" in other countries , can be paid salary at around $1000 - $1500/month .

[ * NOTE :==>> In other countries, if a person has enough so called "" Relevant Work Experience "", a person can be qualified as "" Qualified Professionals / PMETs "" in their own countries , despite lack of education .

It's like Singapore in 1950s to even early 2000s , when even have Primary School Education alone, is enough to be Top Directors in big companies , like Banks .

( Like poorly educated Bangladeshi / Bangla workers take over PMET jobs, like Engineers & etc. in key industries . . . )

At most, such Cunning Bosses hired these "" CHEAP PROFESSIONALS / PMETs "" & then give them the Positions of IT Engineers , Aerodynamic Engineers , Electrical Engineers , Civil Engineers , Mechanical Engineers , Accountants & etc., in their companies, without letting the clients or, relevant authorities know of the Truth because NOBODY want to CHECK it any way . . . ]

CUT CORNERS a lot to MAXIMIZE PROFITS of Companies & EARN HIGH SALARIES & HIGH BONUSES by Top Management , BUT, DON'T CARE whether can give Good Quality Products & Services OR not , even if end up giving only Bad Products & Bad Services .

These usually happen in Construction Industries, Heavy Engineering Industries & other industries, or companies that are HIGHLY CONSERVATIVE & LABOUR INTENSIVE , in which both UNPROFESSIONALISM & UNETHICAL PRACTICES have BECOME A WAY OF LIFE in the CORPORATE / INDUSTRIAL CULTURES in such industries over many years .

* * NOTE :==> Singaporean Work Force is one of the MOST HIGHLY EDUCATED & BEST in the world, even recognized internationally by reputable international bodies , so Singaporean employees can’t be that Bad or Lousy to be justified easily to be SACK by management of Singaporean employers .

I wonder whether our HIGHLY PAID TOP CIVIL SERVANTS have really CHECK on this PROBLEMS over so many years ? ? ?

Really need more “ FIREMAN “ type of Ministers, like Dr Khaw Boon Wah & even Mr Shanmugan, to CLEAN UP , make full HOUSE CLEANING ( Chinese mean : 清理门户 ) & RESTRUCTURE all the MESS that have happened in our “ MOST EXPENSIVE CIVIL SERVICE IN THE WHOLE WORLD “ & even Private Sector , BUT need still quite reliable Non-PAP political leaders, like Mr Mr Low Thi Khiang & now, Dr Tan Cheng Bock, to press such cases to happen . . .

Don’t you ALL in this Website THINK so ? ? ?

Any COMMENTS from you PEOPLE out there ? ? ?
More",0.0,0.104,0.793,0.103,-0.4609
64,1.0,"To Everyone in this Website, Especially John.
Are you a bot?",1.0,0.0,1.0,0.0,0.0
65,1.0,"I agreed that they should review as we have the most rigid school system in the world. It does not motivate learning, creativities and curiousities. It just produce exam smart ppl. Not scientist, inventors, thinkers and so on. If we can produce these ppl. I say we achieve another great success in our education.",0.0,0.098,0.705,0.197,0.8108
66,1.0,exam smart people when they do things they then to zoe swee swee.,1.0,0.0,0.816,0.184,0.4019
67,1.0,"Only 2-3 days of school per week is optimal, given our advanced internet availability",0.0,0.0,0.727,0.273,0.5423
68,1.0,"@willie le chien courant
Not yet, right! But the idea remains sound. Try it!",1.0,0.0,1.0,0.0,0.0
69,1.0,i game u fifty dollars you don't have school going kids now. on?,1.0,0.0,1.0,0.0,0.0
70,1.0,Dare to change...so Singaporean should follow new MOE courageous to make G change.,0.0,0.0,0.764,0.236,0.5267
71,1.0,"CEOs tell Trump they are hiring more Americans without college degrees:
WASHINGTON (Reuters) - Chief executives of major companies said at a White House forum on Wednesday that they are hiring more Americans without college degrees as they search to find increasingly scarce applicants for open jobs.",0.0,0.0,1.0,0.0,0.0
72,1.0,Great Move!. It removes the stigma and yet it also (fortify) strengthen the difference in individual subjects streaming indirectly.(quite similar to modular system in Universities),0.0,0.0,0.775,0.225,0.7712
73,1.0,Secondary kids may not be ready modular system. They may even forget to attend lessons. Timetabling would become overwhelmingly complex. Teachers will have to contend with very diverse ability students. Oh well....,0.0,0.152,0.744,0.104,-0.1856
74,1.0,"Top Talents, Scholars, Meritocracy, Ministerial Material, Ministerial Salary, etc.",0.0,0.0,0.484,0.516,0.6597
75,1.0,"Singapore and its political leadership and judiciary are key promoters of neo-imperialism by the West - through promoting graduates of western universities over local graduates by giving them privileged positions, highest salaried jobs and top ranks in Judiciary and Civil Service in return for million dollar incomes and power. Almost every Minister, Judge and high ranking and highly paid public service official today is a graduate of a university in UK or USA who is fast tracked over local graduates. Foreign grad lawyers are given precedence over local university grad lawyers. Foreign grads take instructions from their imperial masters in the West without any regard for national interests. To keep local leaders in check, the neo Western imperialists set up and support a shadow team ready to takeover if the team in power fails to heed their imperial masters. Which is why the neo imperialists support the local leaders and also the vocal opposition at one and the same time.
In Singapore the government grooms Chinese elites from a young age and even sponsors their training in top universities at Oxford, Cambridge and Harvard.
The Chinese Christian elites are stooges of foreign firms, foreign universities especially Harvard Oxford and Cambridge and of foreign powers and will never mete justice to Singaporeans who are not elite Chinese Christians.
For the last 40 years, Sg gov has been selecting, training and sponsoring Chinese Christian supremacists in Oxford, Cambridge and Harvard amongst other top universities abroad without the whites realising it. These come back and perpetuate Chinese Christian supremacy in Singapore and token meritocracy.
PAP rapidly expanded its elite class these last 20 years by paying million dollar salaries to especially some Chinese Christians especially alumni of Cambridge, Oxford and Harvard to promote them to the million dollar salary club and also by funding their children's education at Harvard, Cambridge and Oxford universities.
The Chinese Christian elites lawyers from these law firms are stooges of foreign law firms, foreign universities especially Harvard Oxford and Cambridge and of foreign powers and will never mete justice to Singaporeans who are not elite Chinese Christians.
More",0.0,0.028,0.894,0.078,0.9209
76,1.0,don't be an idiot. why? you anti-christian.,1.0,0.0,0.689,0.311,0.4023
77,1.0,"If only you know the hugely different standard in graduates, you will not say it is due to Imperialism.",1.0,0.0,1.0,0.0,0.0
78,1.0,"Primary school and secondary school streaming of students is one of the most helpful, pragmatic policies that's imbued with maximisation of talent vs resources, plus a topping of most human touch.

Streaming is good for you!",0.0,0.0,0.779,0.221,0.8436
79,1.0,"Is the main purpose of education social engineering? In other words, supporting the nonsensical belief that all children are of equal academic ability, becoming brain surgeons, brilliant architects, world-class philosophers? The much-reviled streaming allows those of a practical bent to harness their equally valuable skills, setting them on paths leading to training in trades so lacking in society today.

Likewise, see the pickle several top-flight British universities are in, being forced to make more places available [at the cost of rejecting able others] for students from 'disadvantaged backgrounds', admitting them with lower school grades, ignoring the reality that such pupils have been let down by the low standards in many British State Schools, from which so many leave after years of compulsory education unable to count, read and write to a decent level, and to conduct a grammatical conversation not riddled with slang.
More",0.0,0.11,0.814,0.076,-0.5328
80,1.0,A Rose by any other name! Or some may prefer LPPL?,0.0,0.0,1.0,0.0,0.0
81,1.0,"Good move! It allows for students to develop according to their own strengths and encourage more mixing of students of different aptitude and background. This prepare the students better, cause in the real world, we live and work with people of different talents, skills set and backgrounds.",0.0,0.0,0.736,0.264,0.9336
82,1.0,"Our elites are implementing this new system due to their political consideration. Let me list some of them below:

1) Social stratification is gradually emerging in school

It is getting more common to see more and more non-Chinese students in the technical or normal stream while the Chinese students filled up the majority of the slots in the express stream. For political consideration, our authority is trying to 'break up' the huge pools of non-Chinese students in the technical or normal stream by merging them with the Chinese students in the express stream but they would not be able to do that with our current streaming system, which effectively reinforces the stratification due to the differences in the students' ability.

This is because if you allow too many non-Chinese students to concentrate in a particular area (technical or normal stream classes etc), there is always a political risk that they would band together as a race (especially the Malays who are more united as a race as compared to the Chinese who tend to be self-interested individuals) and turn against the authority. Our political elites want people to unite so they are able to compete better as a group, but not to the extent that the people are so united as to be able to threaten the system or our elites themselves. This is a delicate balancing act that our elites want to maintain.

With this new system, they would be able to merge them into the same class - by combining a smarter 13-year-old Chinese student with a slower but older 14-year-old non-Chinese student in the same class!

If you don't believe me, just take a look around the schools and see the race stratification for yourself that is currently present in our schools. Even for our tertiary institution like polytechnics, after 6 pm, the whole polytechnic would suddenly turn into a 'non-Chinese campus' as the majority of the part-time diploma students who attend night classes are non-Chinese! It becomes a Chinese institution during day-time and a non-Chinese institution at night-time!

2) Divide and control

As mentioned in (1), our political elites are not doing away with school streaming out of their goodwill or kind heart, they are doing this out of their self-interest and political necessity - to 'break up' the huge pools of non-Chinese students concentrated in an area by merging them with the rest. Our elites know that these students would still be able to mix well enough for them to perform in school but not to the extent that they become united enough as a race to form a credible threat to our elites. This is their true agenda - to divide and control when these students are young and not united yet. This is actually a pre-emptive measure.

I would also like to bring to people's attention some of the social stratifications that are already present in the workforce and in the government, if our elites are serious in eliminating such phenomenon, they should look into them seriously as well. Some examples are:

1) Why the majority of the frontline of our Singapore Police Force is stuffed with non-Chinese? Since when does our SPF become a non-Chinese force?

2) Why the majority of the frontline counters of our various government agencies (like CPF, HDB, ICA etc) are stuffed with Malays or Indians? The Chinese cannot do frontline counter jobs? Why are the Chinese so special? Are Malays born to do counter jobs?

3) Why are SMRT staff mostly non-Chinese?

4) Why are grab food, food panda delivery guys mostly non-Chinese?

And many more examples as well.

Even though my highest qualification is 'O' Level, I actually prefer our current streaming system because it allowed me to mix with people who are similar to me, in terms of intellectual level. In my period, we were able to converse well in various topics and since we were also of the same age, we were able to bond well with one another.

Personally, in this new system, I think I would find it unbearable to mix with someone who cannot even understand moderate English, these people are so annoying and stupid and I would find it insulting that they are even in the same class as myself and sitting beside me!

Try mixing long enough with these stupid people and you would end up becoming stupid yourself in time! Stupidity is infectious!

I will end my comment with this wise quote from renowned businessman Jim Rohn - ""You're the average of the five people you spend most of your time with!""
More",0.0,0.051,0.842,0.108,0.9919
83,1.0,"Remove streaming should also extend to IP, GEP, SAP, etc. Not just Express, Normal, NT.

Back to good old days, every student is not sensitive about their student's brand names. Eg, our neighborhood secondary school's name sounds very good to us, becoz most of neighbors attended the school. Only some odd ones traveled all the way far far to study sec sch.",0.0,0.034,0.855,0.111,0.6369
84,1.0,"To Everyone in this Website, Especially PAP, Opposition Parties & All Singaporean,

To improve our competitiveness in Global Economy , We really must REVAMP our entire school education system , in actual fact, it should have been Done it in over 20 years ago, during the 1990s .

From this website on “ Subject-Based Banding to replace streaming in secondary schools by 2024 by Singapore Government , it has EXPOSE OUT these BIG PROBLEMS in Singapore that had spread over many years .

Unfortunately, our “ MOST EXPENSIVE GOVERNMENT IN THE WHOLE WORLD “ don’t seem to do much on it , though TALK very BIG in Mass Media that our “ MOST EXPENSIVE GOVERNMENT IN THE WHOLE WORLD “ is doing so ! ! !

The PROBLEMS that we are facing now are these , due to the very Harmful Effects of "" DON' T CARE "" of or , should say, SACRIFICE Professional Ethics & Moral Education for many years :===>

(1). Bad CORORATE CULTURES & Unethical SOCIAL VALUES are widespread in Singapore Business World & Singapore Society .

Even our so called "" MOST CLEAN & UNCORRUPTED CIVIL SERVICE IN THE WHOLE WORLD "" , which is Singapore Civil Service , are now affected, due to Big Scandals had happened over these few years, like of SEX – FOR - CONTRACT , SEX – FOR - GRADE , SEX - FOR - FAVOURS, UNDER - TABLE FAVORTISM , CORRUPTION , ABUSE of POWER , INTENTIONAL IRRESPONSIBLE ACTS & etc. .

(2). LACK of INTEREST on the Singaporean on things that affect National Interests & the Well-being of Society , which have led to the terrible consequences of Neglect .

[ WORST , it had led to INFLUENCIAL People , like so called “ ELITE CLASS “ as mention in here , that are Unethical HYPOCRITES & Big CHEATERS ( Like T T Durai , Richard Yong , Peter Lim Sin Pang , Ex-NUS Law Professor, Dr Tey , Pastor Kong Hee , Sun Ho ( Pastor Kong Kee’s wife ) & etc. ) to INFLUENCE the society or, BRAINWASH people to become BAD & EVIL .

Also , WORST , even civil servants, or staff under their control / charge are being made to be their almost YES MEN & LACKEYS / WALKING DOGS to do bad things or unethical acts for them , by forcing their staff to obey their ILLEGAL / UNLAWFUL / UNETHICAL ORDERS . . .

So, the Consequence is that you Either join them to be BAD GUYS too , or, You get SACK from your Jobs ! ! ! ]

(3). The KNOWLEDGE & SKILLS of Singaporean work forces are now facing STRONG COMPETITION from other newly emerged economic countries, like China & India .

The Ministry of Education has not change its educational systems much to counter this measures , may be due to Clumsiness , Complacency , Ignorance or WORST , PREVENT from doing so by some Self-Interest Pressure Groups within or outside of Civil Services , through erection of "" PROTECTIONISM "" inside the organizations .

* * * NOTE :==> As Mao Tze Tong, that Ex- Supreme Leader of China once said this words :==> “ If want to undergo Reform or Restructure, MUST first KNOW who your ENEMIES & FRIENDS are “ .

This is BECAUSE Friends will SUPPORT the Reform & Restructure, BUT, Enemies will OPPOSE the Reform & Restructure, regardless of how Good the Reform & Restructure are .

As this Old Chinese saying has highlighted : “ 非我族类，其心必异 “ or, “ 志不同 ， 道不合, 其心必异 “ or, “ 阳奉阴违 “ .
[ It means that anyone that don’t belong to our types or, share common belief & objectives with us, will likely go against us or, oppose us in his / her heart & DISOBEY Instruction from superiors & Top Management ]

* * * NOTE :==> In last Bukit Batok By-Election, DPM Tharman said in public that VOTE Dr Chee Soon Juan to be MP of Bukit Batok is like “ GET A FOX TO GUARD HEN DEN “.

However, our Singapore Government has also “ GET A FOX TO GUARD HEN DEN “ too ! ! !

That is, our Singapore Government is really RIDICULOUS to ask such types of ANTI-REFORM Civil Servants & ANTI-RESTRUCTURE Employers to HELP in the REFORM & RESTRUCTURE Singapore Education system , so as to build up Singapore Economy to be 1st Class Economy & save the Job Security of Singaporean . . . So we can all GUESS out what are the Results ? ? ? ]

(4) Too Many so called “ FOREIGN TALENTS “ come into Singapore & some of them have brought lots of Bad CULTURES & Twisted IDEAS to badly INFLUENCE & BRAINWASH Singaporean population .

[ To Foreigners , certain BAD PRACTICES, like LOOSE SEX CULTURE , SEX - FOR - FAVOR , GAY PRACTCES , CHEATING , CORRUPTION , ” Game of Throne ” ( Chinese is called “ 权术游戏 “) types of BRUTALLY DIRTY OFFICE POLITICS, VIOLENT POLITICAL IDEAS & etc., are OK to them in their own nations & they SPREAD such Cultures & Ideas when they are in Singapore ]

Really need more “ FIREMAN “ type of Ministers, like Dr Khaw Boon Wah & even Mr Shanmugan, to CLEAN UP , make full HOUSE CLEANING ( Chinese mean : 清理门户 ) & RESTRUCTURE all the MESS that have happened in our ““ MOST EXPENSIVE CIVIL SERVICE IN THE WHOLE WORLD “ & even Private Sector . . .

Any COMMENTS from you PEOPLE out there ? ? ?
More",0.0,0.137,0.755,0.109,-0.9845
85,1.0,Low so.....,1.0,0.677,0.323,0.0,-0.2732
86,1.0,"heng ah, you give me budget so low! ong yah and hen got so much more than me. next time population get smaller but i still have to maintain the same number of classes, where got enough money to employ so many teachers?
no choice lah, need to give ong more money to bring in elite prc to do research and hopefully improve our stock. also hen needs money to improve the howizter alarm system. try to thing of something can or not?
ah, i got an idea. we can do away with separately streamed classes and just lump them together in the same class to take the same lessons but different level of difficulty exams. i good or not!?
yea, you are my man! I will remember you when i become boss.
More",0.0,0.075,0.804,0.12,0.8271
87,1.0,"They should also do away with streaming in primary school. The current education system is very academic based.it doesn't prepare students (primary,sec ,pre-u and university) for the workforce of future.The future of workforce will be dominated by technology,AI ,robot in a highly interconnected so soceoty. The value of education has to be refined as what it really means to us in future",0.0,0.0,0.957,0.043,0.3947
88,1.0,"Unless there are relevant jobs in Singapore, the top students will relocate to a country with more options. Why stay in a red dot when there is a whole world of opportunities.",0.0,0.0,0.86,0.14,0.5267
89,1.0,"subsidies the foreign from around the asia and sponsor those talent from foreign land over the local uni , does it even fit to talk abt social stratified and division?",0.0,0.0,0.836,0.164,0.6486
90,1.0,"when SDP, Dr Chee talk about removing streaming in school, who listen ?
after 25 years, finally wake up !
Dr Chee also mentioned about raising of GST from 5% to 7% and coming to 9%
7 years ago in hokkien speech, who listen ?
More",0.0,0.0,1.0,0.0,0.0
91,1.0,"Let us give credit where credit is due. Minister Ong has shown leadership to address an issue which has been raised for years, even by his own parliamentarians. I hope other ministers could emulate Min Ong to address other issues which have been brought up for years - say CPF issue on withdrawal age, for medical treatment etc by Mininster Teo Josephine. It is good for ministers to re-validate certain policies, and assess their relevance. Well done Minister Ong YK - hope others have belly of guts like you. You display leadership. That's what we expect of our ministers.",0.0,0.0,0.8,0.2,0.9565
92,1.0,Gd change. The benefits are much greater.,0.0,0.0,0.495,0.505,0.6249
93,1.0,Now after more than 40years finally they know it was a mistake?,0.0,0.194,0.806,0.0,-0.34
94,1.0,"I can’t trust PAP government anymore. During that year, the minister in charge of education talked very convincing about streaming and now everything back to the same! For many years PAP government has accumulated wealth for themselves and exploited the feeling of many Singaporeans.

In fact They are destroying every Singaporeans’ dreams.
LBW said we have good AH Kong but she didn’t mentioned that our AH kong has too many illegitimate grand children that our AH Konghas to give free education to these illegitimate grand children which are foreign to us.
The country has come to this state is because our gov focus on $$$ in their pockets and not us, Singaporeans.
More",0.0,0.033,0.781,0.186,0.9568
95,1.0,The surest way to travel to the sun is by night!,0.0,0.0,0.794,0.206,0.3802
96,1.0,"After numerous years of feedback from the parents to remove streaming, they finally act on it. This means one thing. Election is coming and new 4G leadership is rolling out policy that will help to win votes. Why not announce such policy change last year?",0.0,0.0,0.869,0.131,0.7579
97,1.0,"This is a good move. But it is quite late. Look at how many people are suffering because to get good grades. How many people could not get to university because of the stringent criteria on Local students (yet giving money to overseas substandard students to study in local university), people had to study part time and go through long routes to just get a diploma and degree. And scholars (whom had good family background) taking high paid jobs and not thinking for the average people. This is not toy - pls think of people in the long term and not just set policies to support your term. Now, those whom are in their 30s and 40s have suffered under the stupid education system.
More",0.0,0.079,0.82,0.1,0.4363
98,1.0,"Had the likes of Gates, Jobs, Bezos, and Zuckerberg been in Singapore’s streaming, the world would be very different as we know it.",0.0,0.0,0.887,0.113,0.4215
99,1.0,Pls look at how scholars are produced. And should they drive policies when they are so stuck up. And look at how military are being parachuted.,0.0,0.094,0.86,0.047,-0.3218
