,article_id,comments,is_reply,neg,neu,pos,compound
100,1.0,"Wow! It's only last week that PAP MP Louis Ng raised this as a suggestion in Parliament and now, a week later, we hv an announcement. Should we be proud of this most efficient government in the world?",0.0,0.0,0.762,0.238,0.883
101,1.0,Can more info be shared then how the post result affect enrolment to poly or JC etc?,0.0,0.0,0.857,0.143,0.3947
102,1.0,"I supposed LET ME GUESS.

This change will NOT affect the off-springs of the Elites.

MOST likely they will have ALL the facilities at their Disposal to Perform to Peak( being from the Elite.)

The rest of the People will succumb to UN-Stoppable U-TurnS of the Education Policies ON every change of MOM Ministers/Elites.

I ask again so do still have that Nobel Level Scholars?

Though we spent TONS of Money in the Varsities pulling ""Scholars/Expertise.."" to boost the GLOBAL RATINGS IN EDUCATION.
More",0.0,0.0,0.968,0.032,0.4019
103,1.0,"correction:

The rest of the People will succumb to UN-Stoppable U-TurnS of the Education Policies ON every change of MOE Ministers/Elites.",1.0,0.0,1.0,0.0,0.0
104,1.0,Why? Streaming is good.,0.0,0.0,0.508,0.492,0.4404
105,1.0,"Just do well in PSLE, those IP students will sail smoothly all the way to A level.

Not fair for those N and O students, got to fight for JC and Poly places.

The key of the streaming is now at PSLE.
More",0.0,0.104,0.847,0.048,-0.3532
106,1.0,seriously we need better ministers to helm education ministry!!,0.0,0.14,0.575,0.286,0.4184
107,1.0,Why not 2020? Why 2024? Still want to play GE gimmick?,0.0,0.0,0.68,0.32,0.5007
108,1.0,"Streaming from start is a mistake,but still now they don't admit it...",0.0,0.137,0.863,0.0,-0.1511
109,1.0,this should be the way,0.0,0.0,1.0,0.0,0.0
110,1.0,Sounds like the GRC system!,0.0,0.0,0.589,0.411,0.4199
111,1.0,"That means in the past few decades, some of the PAP ministers basically were not working, their jobs was to follow their previous ministers ""guidelines"" and innovate new ways to tax their countrymen.",0.0,0.0,0.909,0.091,0.4939
112,1.0,"WHAT ABOUT SEPS SCHOOLS?
this is THE major stigma that leads to elitism that forms the distinct gaps!
such move will only distinguish this elite groups further away from the mass, holding them 'untouchable' in moral and social.
likewise, what about educators themselves????
More",0.0,0.0,1.0,0.0,0.0
113,1.0,Subject Based Streaming is still streaming.,0.0,0.0,1.0,0.0,0.0
114,1.0,Gimmick. As if there is real change.,0.0,0.0,1.0,0.0,0.0
115,1.0,"When the pap flip-flops big time,it's called ""A major policy shift"". When the opposition as much as rephrase any statement even a miniscule bit,they're lambasted for flip flopping and not coming clean.",0.0,0.07,0.93,0.0,-0.3089
116,1.0,How about streaming PM n MP salaries? ?,0.0,0.0,1.0,0.0,0.0
117,1.0,"After election, things might change again...",0.0,0.0,1.0,0.0,0.0
118,1.0,Why don't stop immediately. Waste time.,0.0,0.0,0.487,0.513,0.4973
119,1.0,"IP is like immunity in the Survivor Game. Once you got it, you are exempted from the MMA ring at GCE O Level, now G3?

LOL",0.0,0.0,0.721,0.279,0.8192
120,1.0,"Back to square one, after 40 years😜",0.0,0.0,1.0,0.0,0.0
121,1.0,40 years ago got subject based banding?,1.0,0.0,1.0,0.0,0.0
122,1.0,In short they admitted they have madeca mistake last time.,0.0,0.203,0.678,0.119,-0.25
123,1.0,"Why need to study much, at the end, the 4ligners getting the jobs",0.0,0.0,1.0,0.0,0.0
124,1.0,"social stigma is unavoidable. even without streaming.
in top school, a student from A class will look down on students from the last class.
and the leech will look down on the poor.
anyway, its tuition. those who can afford the best tutors end up with good grades.
and they are from the leeches.
how many from the lower income have good educational outcomes?
More",0.0,0.093,0.771,0.135,0.6259
125,1.0,This means election is coming ..lol,0.0,0.0,1.0,0.0,0.0
126,1.0,"Pls see - a lot of China couples (1 person don't want to convert to PR or citizen). And you know why? So that they can sell off their house here and get a house in their country. They are in fact having 2 houses (1 in China, 1 in Singapore). And when they are old, they will sell their Singapore house and make $, and then live overseas. But Singaporeans - our family and parents are here, do u want us to abandon them and migrate? What a stupid immigration policy",0.0,0.102,0.884,0.015,-0.7785
127,1.0,"PAP playing with policy like musical chair game.
Up to them play you like a monkey fool.
No wonder, Everyone say that Singapore are full with changing policies.",0.0,0.144,0.595,0.261,0.4767
128,1.0,"Brainless... plan without thinking...
Anyway, this stupid system ended up only will BENEFIT those 2nd class citizen from 3rd world countries as China and Philippine and India",0.0,0.122,0.764,0.114,-0.0688
129,1.0,The new minister just wanna change to mark his era! Is he saying the past ministers are stupid? Yes it takes decades to realise it?,0.0,0.136,0.773,0.091,-0.3296
130,1.0,"This Pinky Lee shouldn't have enter Singapore politics at all!!!

Stupid Pinky Goh!!!",0.0,0.276,0.724,0.0,-0.6776
131,2.0,"Possible reason for this sort of polling result is because top schools have many PR children. Those from Taiwan, China or India more kiasu and kiasi than locals. Normal stream has many locals so its normal for them to want to mix up with the express while their PR parents cannot be bothered what the local govts are doing as long as they can continue with the education and then move out of the country. Just look at the University...how many bond breakers and foreign students do you see?",0.0,0.0,0.944,0.056,0.47
132,2.0,"@ Peter, most of ur tribe members cannot make it, so how to break bond?",1.0,0.0,1.0,0.0,0.0
133,2.0,Top schools do not have Normal classes,1.0,0.0,0.769,0.231,0.2023
134,2.0,Bond breakers are CHINESE. Your own race.,1.0,0.0,1.0,0.0,0.0
135,2.0,Top schools do not have Normal classes,0.0,0.0,0.769,0.231,0.2023
136,2.0,Bond breakers are CHINESE. Your own race.,0.0,0.0,1.0,0.0,0.0
137,2.0,it's called the NIMBY attitude. We've seen it in alot different controversial topics,1.0,0.283,0.717,0.0,-0.516
138,2.0,Same like our election polls. Keep complaining about government but in the end still vote for...,1.0,0.082,0.816,0.102,0.09
139,2.0,Precisely...those who are vocal are usually those who disagree...parents who prefer to keep their child mixing with the higher class will normaply just keep quiet.,1.0,0.0,1.0,0.0,0.0
140,2.0,No one takes Yahoo polls seriously. Are you new here?,1.0,0.328,0.672,0.0,-0.4404
141,2.0,Why should there be an issue having my kids from express stream mixing with normal stream students?,1.0,0.0,1.0,0.0,0.0
142,2.0,I always vote opposite my mind to confuse all. Specially polls related to polictic,1.0,0.137,0.863,0.0,-0.2263
143,2.0,No one takes Yahoo polls seriously. Are you new here?,0.0,0.328,0.672,0.0,-0.4404
144,2.0,"@KK Thats the thing. But over here, there is a blind emphasis on grades only.",1.0,0.172,0.828,0.0,-0.4019
145,2.0,Why should there be an issue having my kids from express stream mixing with normal stream students?,0.0,0.0,1.0,0.0,0.0
146,2.0,I always vote opposite my mind to confuse all. Specially polls related to polictic,0.0,0.137,0.863,0.0,-0.2263
147,2.0,"RI is an independent school, it will never happen there.",1.0,0.0,1.0,0.0,0.0
148,2.0,You can mix them but does not mean there will be integration.,0.0,0.0,1.0,0.0,0.0
149,2.0,"Maybe those who chose ""No"" in the poll do not even have a child? S'pore's birthrate is afterall very very low. And those who chose the other options maybe be naturalised S'poreans or new citizens?",0.0,0.084,0.916,0.0,-0.4645
150,2.0,"@ Nosey47,
U can claim anything online. That is understood.",1.0,0.0,1.0,0.0,0.0
151,2.0,Birthrate is low because you CHINESE think you need $1m to raise per child or you will lose face.,1.0,0.22,0.78,0.0,-0.5859
152,2.0,"Your observation is valid, the results are skewed. Many of those who vote at all here are likely from normal. The express ones are either not voting/abstaining or cannot be bothered.",1.0,0.0,0.939,0.061,0.2411
153,2.0,"You are totally wrong. I have 2 boys and they mixed with friends from all walks of life. To tell the truth, it does benefit them and build up their EQ which people like you will not be able to understand.",1.0,0.07,0.704,0.226,0.7584
154,2.0,"Polls in yahoo visited only by normal layman , to be honest from I understand from my previous company boss who belong to local universities working for statutory hoard with fat bonuses and with elitism belief, they will visit only garment controlled websites like CNA and straitstimes , so the poll is must BIAS and untrue, this reflect only 20% of the Sentiments only, likewise for elections, here 90% will shout for opposition parties to win more seats but eventually Nothing comes out better every elections, hence it's better we influences people 9n mainstream and get them to agree that not every policies im0limpleme by elites are good, there must be balances.
More",0.0,0.062,0.798,0.14,0.8301
155,2.0,I pity Wendy Chan's children due to her attitude and mindset. Her children will miss out living a full fun life with other children. It's sad.,0.0,0.228,0.662,0.109,-0.3818
156,2.0,"To some people, living a full life means indulging in rubbish. I'll skip, thanks.",1.0,0.0,0.805,0.195,0.4404
157,2.0,Hanging put at void deck...having sex...smoking...taking drugs...playing truant...sounds fun to me if u mix with wrong company.,1.0,0.152,0.686,0.162,0.0516
158,2.0,Wendy Chan is a Chinese. What did you expect? No surprise here.,1.0,0.165,0.677,0.158,-0.0258
159,2.0,To be honest...i would. I would prefer my children mixing with express and special stream than normal or normal technical. The word is prefer...i believe its the same gonest sentiments shared by many parents. The environment and the crowd u mix with makes a difference in your life. There is a saying that if you want to know your social standing....just name who are toyr tgree closest friends...they will most probably reflect your current social standing as well.,0.0,0.0,0.892,0.108,0.7579
160,2.0,Last time they said streaming is good...now change bosses...new boss said no good..what's next? u mean last time the ministers all no good...now paid more so must try to confuse people that they are more talented..,0.0,0.164,0.836,0.0,-0.6486
161,2.0,"Ok lo, let them stream to express lo. These students are molded by government and prepare them to be followers. Always follow the system, rigid and straight.

While normal students dare to do things and try things differently. Seen many bosses from the normal stream employing dozens of local U grads lol",0.0,0.027,0.848,0.125,0.6597
162,2.0,"In fact, is the Principal & teachers in my school who differentiate the Express & Normal...I was in the Normal stream...Principal & teachers are the ones who tell the Express to stay away from Normal Students else will become like us.",0.0,0.0,0.937,0.063,0.3612
163,2.0,would the normal kids want to mix with express kids then?,0.0,0.0,0.885,0.115,0.0772
164,2.0,Social stratification cuts in all directions.,1.0,0.306,0.694,0.0,-0.296
165,2.0,"Before streaming in the old days, we didn't have a choice. But the smart ones go to the 'A' or 'B' classes, the slower ones go to 'C', 'D' and 'E' classes. But all are considered Express stream. The dropout and failure rate was quite high.",0.0,0.067,0.878,0.055,-0.1531
166,2.0,"If I were the children, I rather go with streaming because if I am a slow learner, it would be very stress for me to mix with the elite students. I will feel that I am under pressure. Good thing is with this streaming, weak students who want to learn can always approach the clever ones",0.0,0.138,0.741,0.121,-0.2484
167,2.0,"They are still streamed under G1 to 3. Those belong to a new category will be schedule to sit different class. Imo, this is an improvement. One student maybe be bad languages but doesn't mean his Maths or Science is weak. By streaming them to normal stream, it will limit their learning capacity for Math and science.",1.0,0.098,0.836,0.065,-0.4649
168,2.0,i was super express kid. we all grew up together.,0.0,0.0,0.672,0.328,0.5994
169,2.0,"this started as a trial project in 1977.my class of 38 students choose Arts Stream but the principal [pressure from above] came to our class and said since our class is the top of the other Arts Stream classes,we have to study Physical Science and Modern Maths. Initially,we were studying elementary maths.Our favourite subjects,geography and general science were taken out.only 10 of our classmates,smart ones were able to cope with the change.rest of us were repeat students",0.0,0.0,0.972,0.028,0.296
170,2.0,"if your so-called, 'smart' kids fell into the 'bad' kids, then its the parental upbringing failures. -- not the schools. -- schools are academic education.",0.0,0.111,0.889,0.0,-0.4588
171,2.0,In the olden days we make friend much easier regardless of status. These days there is no Kam-pong & the comparison of status is so serious due to the advancement of the mind-set to being snobbish. In the olden days the mind was not so working as there were less advancement as of these days of the advancement.,0.0,0.091,0.815,0.094,0.2866
172,2.0,"In the past, the majority of dumb local born S'poreans not so yaya. But that changed with P@P rule, along with decades of elitism.",1.0,0.125,0.875,0.0,-0.5106
173,2.0,"It should observe a person character, attitude and behavior rather than a person intelligence?",0.0,0.0,0.78,0.22,0.4767
174,2.0,"How about our ruling party, can they mix with oppositions in the house, is there any issues? I can see a lot of issues",0.0,0.0,0.886,0.114,0.4019
175,2.0,"Not a problem, as long as the schools are top performing and have a challenging curriculum. I hope Singapore doesn’t marginalize their school system",0.0,0.0,0.665,0.335,0.762
176,2.0,"same stats as the ratio of voters. 67% are supporters, 10% are elites that are not affected because there is no mixing in IP schools like RI and RGS, and the 23% are those that aspire to have their kids in the IP schools but not able to cross that gap.",0.0,0.03,0.878,0.092,0.323
177,2.0,After all this kids get older some of the normal stream will get better job than the express students.,0.0,0.0,0.861,0.139,0.4404
178,2.0,wendy chan is the product of 5 decades of leegime indoctrination.,0.0,0.0,1.0,0.0,0.0
179,2.0,"As long as any school is gov-aided or supported, MOE should insist these schools take in students with non-Express PSLE T-Scores to show that these schools can value-add. Also, this will in the long term help social cohesiveness.",0.0,0.0,0.878,0.122,0.6124
180,2.0,"This poll only tell 1 thing, the one who asked (or ""commissioned"") it needs some moral guidance",0.0,0.0,1.0,0.0,0.0
181,2.0,the notorious india caste system indoctrinated into singapore.,0.0,0.417,0.583,0.0,-0.5106
182,2.0,"I’d question why IP is not part of this integration ?? If the goal is really to give all student a level playing field, then the more IP be included bcos my view is that IP is where the real elites are.",0.0,0.0,0.949,0.051,0.2869
183,2.0,"Maybe we need to get everyone to recite Singapore pledge again.
There is one part

"" pledge ourselves as one united people,
regardless of race, language or religion,
to build a democratic society
based on justice and equality
so as to achieve happiness, prosperity
and progress for our nation.”

Because now we are seeing a lot of difference for many years.

Express, normal, normal tech
EM1, EM2, EM3
Rich, poor

Even the P6 paper teach students that people working in kopitiam is poor regardless of the truth. But judge base on
Job. Base on education level.
More",0.0,0.056,0.777,0.167,0.9062
184,2.0,"my other classmates from sec.2 who maintained studying Arts Stream did very well later in their adulthood.Actually,myself and my classmates who repeat O levels can study because of this screw up,spoil our interest in studies.Our parents at that time couldn't care less about what was happening.",0.0,0.082,0.812,0.107,0.3105
185,2.0,"Would you have an issue if you have fallen madly in love with a beautiful/handsome person of a different ethnicity from yours, and you're desperately and madly ready to marry her/him?",0.0,0.261,0.572,0.167,-0.4215
186,2.0,What problem? Only got problem w mixing with aliens.,0.0,0.474,0.526,0.0,-0.6597
187,2.0,Good. Now express students dun grow up wrongly believing they are superior beings and normal students dun grow up wrongly thinking they are inferior junk.,0.0,0.087,0.707,0.206,0.5719
188,2.0,"So sad that in a country as modern as Singapore that pride herself in one race one people , etc thst we talk about segregation. Isnt it better gor he kids ti decide if he prefers a faster thuss express or slower m thus normal himself? Ut is all about nurturung a good character jot how fadt or slow you graduate. Many famous folks also never graduate. In this world...less educated does not mean less successful. Good lord...please do not do this poll.",0.0,0.098,0.813,0.089,-0.1858
189,2.0,Can such polls be taken seriously? The majority of dumb local born S'poreans are after all Champion Complainers who have repeatedly returned P@P to power.,0.0,0.227,0.652,0.121,-0.34
190,2.0,Only 1diots like you take Yahoo polls seriously. I now realised that you indeed have low IQ. That's why you're a racist.,1.0,0.297,0.608,0.095,-0.6486
191,2.0,Oh its you? The express students ah? Sad. When wanna work under me? A normal stream student :),1.0,0.168,0.693,0.139,-0.163
192,2.0,"Yes, cannot be trusted at all. The outcome and actual fact always opposite especially polls related to politic.",1.0,0.12,0.753,0.127,0.0377
193,2.0,the nerd and geek ministers have realised they have social issues because they were grouped with nerds and geeks. so now to better understand the 99 percent they decided to mix it up,0.0,0.144,0.772,0.084,-0.0609
194,2.0,"Express stream doesn't mean you are smart or clever. You can have an IQ of 200, but if you can't put logic and practicality in place, you are still as stupid!",0.0,0.133,0.762,0.105,-0.4664
195,2.0,Stupid poll. Only the dog_eyes_look_people_downers will ask this kind of stupid question.,0.0,0.415,0.585,0.0,-0.796
196,3.0,"""“I am sure streaming was not meant to divide our nation by social economic status, but we now see streaming does contribute to it.""

PAP MP Ng, you got that totally reversed. Lol. The right question is WHY students from low SES families end up in the bottom streaming tiers. Find out where are the barriers (eg. tuition $?) , where are the inequalities and unequal playing fields (work part-time to supplement family? Less attention from teachers? Etc)",0.0,0.067,0.835,0.099,0.4132
197,3.0,Maybe the elites wouldn't tell him the reasons and he doesn't want to go talk to the lower tier families?,1.0,0.16,0.84,0.0,-0.3447
198,3.0,"Most of the pap mps don't even understand Politics. They are just paid pawns to do the ""kind, Mr. Nice"", role.",1.0,0.0,1.0,0.0,0.0
199,3.0,"Most of the pap mps don't even understand Politics. They are just paid pawns to do the ""kind, Mr. Nice"", role.",0.0,0.0,1.0,0.0,0.0
200,3.0,"Totally agreed.Don,t meddle the education system.",1.0,0.0,1.0,0.0,0.0
201,3.0,Any system will have double edge. CPF that built Spore will one day destroy Spore. Same for GRC which PAP think is a scared cow to worship.,1.0,0.203,0.728,0.07,-0.6369
202,3.0,"The coming election will be challenging for PAP. They need to consider if they lose the GRC, they going to lose the heavy weight ministers. GRC will be good for opposition this time but not for PAP. The chance of losing another GRC is high. They already lose heavy weight George Yeo.",1.0,0.173,0.733,0.094,-0.7096
203,3.0,To SCAM or to be SCAM,1.0,0.689,0.311,0.0,-0.871
204,3.0,"The coming election will be challenging for PAP. They need to consider if they lose the GRC, they going to lose the heavy weight ministers. GRC will be good for opposition this time but not for PAP. The chance of losing another GRC is high. They already lose heavy weight George Yeo.",0.0,0.173,0.733,0.094,-0.7096
205,3.0,isn't this a result of banding not streaming? isn't banding more decisive?,1.0,0.183,0.817,0.0,-0.3055
206,3.0,To SCAM or to be SCAM,0.0,0.689,0.311,0.0,-0.871
207,3.0,"""eliminating streaming in secondary schools in order to reduce social stratification among students""

Why don't he suggest reducing ministerial salaries instead. I am sure the latter works better towards ""reducing social stratification""",0.0,0.0,0.848,0.152,0.6369
208,3.0,"If the parents are rich, they don't have to worry whether the child is NA, NT or Express. They can always study Boarding Schools, International Schools, etc. then go further studies if they wish.

Those stuck are the poorer and/or average parents.",0.0,0.09,0.737,0.173,0.6377
209,3.0,"The rich ""stream"" themselves to other schools.",1.0,0.0,0.625,0.375,0.5574
210,3.0,"we should set up more reformative centres. those who fail badly academically will be forcibly channeled into these centres. those with good eyesight will be channel into a pilot simulator gaming school. another school could let the student do graffiti art on walls. some school could teach them high value hands craft and skill like repair mechanical watches and jewelleries. if they fail miserably in one of them they can switch to another. only when they attain a certain standard in one of the centre will they be release back into society. to compensate for their hardship, their sentence can be carry out in lieu of their reservist in camp training.
More",0.0,0.122,0.789,0.088,-0.743
211,3.0,China action good good,1.0,0.0,0.256,0.744,0.7003
212,3.0,China has those in Xinjiang,1.0,0.0,1.0,0.0,0.0
213,3.0,"Nice try by PAP MP Ng in attempting to anchor and isolate today's BIG issue of social stratification and inequality to a single, low-urgency issue like secondary school streaming.

He is either missing the forest for the trees, or he is trying to get us lost in the woods.

This is what happens when we hv v busy, part-time people in Parliament drawing an allowance that's few x most singaporeans are earning full-time.
More",0.0,0.081,0.851,0.068,0.0
214,3.0,They are allowed to throw up to 6 smoke grenades. mah.,1.0,0.0,1.0,0.0,0.0
215,3.0,"Mr. MP Keep your eye on the goal, to have a great education system. Dragging down top tier students in hopes to raise lower tier students is an incorrect approach. It even goes against Singapore’s motto Onwards and upwards. All levels must have a clear path to excellence and not every program fits every child. If express is a great system for the top tier, don’t change it. Fix what’s broken, provide a path, in one direction, upwards, for all students. Have a transition program for students that are identified as late bloomers, smart, but needing some motivation, etc. The fact is, philosophers and plowmen, each must do their part, to mold a better Singapore
More",0.0,0.029,0.787,0.184,0.946
216,3.0,"“(Streaming) has very successfully lowered student attrition and improved educational outcomes.... um yay, why remove something that works? isn't improvement better? I don't get it",0.0,0.19,0.514,0.296,0.6897
217,3.0,"Minister wants to see outcome only. Doesn't care about how students react, their low esteem, their struggle in life in future.",1.0,0.281,0.719,0.0,-0.7208
218,3.0,"Hello MP don't just score points by not doing your homework. .Streaming is not a bad word people misinterpret it.. Is all about aligning each students to their learning ability. ..We have Tech Stream and Normal Stream making it to Top University and many went on to poly route.. .That's speak about it's effectiveness. .Society cannot have all the cakes.. Is the parents and relatives and friends that stigmatise them... That's where it affect their self esteem...
So Dear MP wake up... Can you give newer ideas. ..Text Book MPs is the last thing I voted for the Party. .",0.0,0.0,0.853,0.147,0.928
219,3.0,"Those students who made it to poly and then uni did so on their own accord. That does not make streaming ""effective"". My 5 years of secondary school education was like hell just because I was from Normal Acad. stream. I still remember how most of the teachers would doubt the capabilities of students by constantly telling them that they should just try going to ITE after N levels instead of even giving a shot at the GCE O levels. The absurd thing here is whenever I used to score an A or B during Sec 5, teachers would say I am ""hardworking"" but for Express students, it is because they are ""Smart"". What a fantastic education system we have.
More",1.0,0.039,0.891,0.071,0.5859
220,3.0,"What is the number? For everyone that make it to the top, how many spiral to the bottom because they were not given a fair chance to learn? Did you see how many of our youth were outcast because they were slower in their early age? In a running race, not every runner start at the same speed but it is not necessary those who are quickest out the block will win. There are some that accelerate slightly slower but our system purge them out before they can catch up.",1.0,0.069,0.845,0.085,0.3796
221,3.0,"errmmm, i would like to agree with you . but Lious wu xia guy gave statistics to back up.",1.0,0.0,0.811,0.189,0.3612
